,Title,Link,Date,Heading,Search Engine
228,"Google Maps gets updated on Android Auto, gets new colour theme",/url?q=https://timesofindia.indiatimes.com/gadgets-news/google-maps-gets-updated-on-android-auto-gets-new-colour-theme/articleshow/105598865.cms&sa=U&ved=2ahUKEwixybSam_iDAxW6r5UCHcvRDQk4FBDF9AF6BAgHEAI&usg=AOvVaw3H1Acqgpek6zLwg9mXZ9UG,2023-12-25 14:52:41.558146,Times of India,google
229,Google Enhances Chrome Security with Automatic Background Checks and Improved Performance Controls,/url?q=https://www.timesnownews.com/technology-science/google-enhances-chrome-security-with-automatic-background-checks-and-improved-performance-controls-article-106260800&sa=U&ved=2ahUKEwixybSam_iDAxW6r5UCHcvRDQk4FBDF9AF6BAgAEAI&usg=AOvVaw3KQZPfsuvWEXdldj1xYPij,2023-12-25 14:52:41.558146,Times Now,google
230,Google Ads introduces auto-generated advertisement tool using generative AI,/url?q=https://m.economictimes.com/industry/services/advertising/google-ads-introduces-auto-generated-advertisement-tool-using-generative-ai/articleshow/102265446.cms&sa=U&ved=2ahUKEwixybSam_iDAxW6r5UCHcvRDQk4FBDF9AF6BAgEEAI&usg=AOvVaw1ZvarXQsdrXHvwp4wh8peX,2023-08-25 14:52:41.558146,The Economic Times,google
231,"Google Pixel Watch 2 to be launched with Snapdragon W5 Gen 1 chip, new 'Safety Check' feature, automatic w",/url?q=https://m.economictimes.com/magazines/panache/google-pixel-watch-2-to-launch-with-snapdragon-w5-gen-1-chip-new-safety-check-feature-automatic-workout-tracking/articleshow/104156477.cms&sa=U&ved=2ahUKEwixybSam_iDAxW6r5UCHcvRDQk4FBDF9AF6BAgGEAI&usg=AOvVaw0eWoHbwSdRdkr8O1IPZ7Mf,2023-10-25 14:52:41.558146,The Economic Times,google
232,Android Auto likely to stop working on these smartphones,/url?q=https://timesofindia.indiatimes.com/gadgets-news/android-auto-likely-to-stop-working-on-these-smartphones/articleshow/106217119.cms&sa=U&ved=2ahUKEwixybSam_iDAxW6r5UCHcvRDQk4FBDF9AF6BAgCEAI&usg=AOvVaw0yXel-V2jdpPPJi_k3TrXc,2023-12-25 14:52:41.558146,Times of India,google
233,CES 2024: Google Unveils Exciting Upgrades for Android Auto in Cars,/url?q=https://www.thehansindia.com/technology/tech-news/ces-2024-google-unveils-exciting-upgrades-for-android-auto-in-cars-850928&sa=U&ved=2ahUKEwixybSam_iDAxW6r5UCHcvRDQk4FBDF9AF6BAgFEAI&usg=AOvVaw1qYvTxib9AOhnXg1zAVcLy,2023-11-25 14:52:41.558146,The Hans India,google
234,"Google I/O: Gmail gets automatic mail reply writing, Bard opens to all in 180 countries as Google pushes AI",/url?q=https://www.indiatoday.in/technology/news/story/google-io-gmail-gets-automatic-mail-reply-bard-opens-180-countries-pushes-ai-2377529-2023-05-10&sa=U&ved=2ahUKEwixybSam_iDAxW6r5UCHcvRDQk4FBDF9AF6BAgIEAI&usg=AOvVaw0ak-msrE5ta-a8b77zLda9,2023-05-25 14:52:41.558146,India Today,google
235,Android Auto will soon let Google Maps see EV battery levels and tell you where to charge your vehicle,/url?q=https://www.engadget.com/android-auto-will-soon-let-google-maps-see-ev-battery-levels-and-tell-you-where-to-charge-your-vehicle-180006872.html&sa=U&ved=2ahUKEwixybSam_iDAxW6r5UCHcvRDQk4FBDF9AF6BAgDEAI&usg=AOvVaw3kKAOTrAfiyjv3CFQB3BDH,2023-11-25 14:52:41.558146,Engadget,google
236,Google announces new features for Android Auto: Details,/url?q=https://timesofindia.indiatimes.com/gadgets-news/google-announces-new-features-for-android-auto-details/articleshow/103672344.cms&sa=U&ved=2ahUKEwjJ0Iibm_iDAxWNqZUCHToXDMk4HhDF9AF6BAgCEAI&usg=AOvVaw0pjgoDxeV_bHKCwzMxjqn4,2023-09-25 14:52:41.558146,Times of India,google
237,"Android Auto Re-Centers Voice AI With Google Assistant Message Summaries, Maps Driving Mode Shutdown",/url?q=https://voicebot.ai/2023/12/28/android-auto-re-centers-voice-ai-with-google-assistant-message-summaries-maps-driving-mode-shutdown/&sa=U&ved=2ahUKEwjJ0Iibm_iDAxWNqZUCHToXDMk4HhDF9AF6BAgJEAI&usg=AOvVaw2eqBu7oQo0nt7hgUy6MH0P,2023-12-25 14:52:41.558146,Voicebot.ai,google
238,Android Auto's Google Maps is getting a sleek 3D look,/url?q=https://www.androidpolice.com/android-auto-google-maps-3d-buildings/&sa=U&ved=2ahUKEwjJ0Iibm_iDAxWNqZUCHToXDMk4HhDF9AF6BAgHEAI&usg=AOvVaw2MUtKGSvHzWR_tLUvga-zP,2023-10-25 14:52:41.558146,Android Police,google
239,Google Maps color palette now available for Android Auto; check what changed,/url?q=https://tech.hindustantimes.com/tech/news/google-maps-color-palette-now-available-for-android-auto-check-what-changed-71700986940630.html&sa=U&ved=2ahUKEwjJ0Iibm_iDAxWNqZUCHToXDMk4HhDF9AF6BAgFEAI&usg=AOvVaw326QeO0aO4SFNnqZxO3axl,2023-12-25 14:52:41.558146,HT Tech,google
240,Google AdSense launches related search for Auto Ads,/url?q=https://searchengineland.com/google-adsense-related-search-auto-ads-433512&sa=U&ved=2ahUKEwjJ0Iibm_iDAxWNqZUCHToXDMk4HhDF9AF6BAgGEAI&usg=AOvVaw0CQr-S-1hzXOVEqNVORivr,2023-10-25 14:52:41.558146,Search Engine Land,google
241,Google is working on automatic picture-in-picture mode for YouTube on Chrome,/url?q=https://www.gadgetsnow.com/apps/google-is-working-on-automatic-picture-in-picture-mode-for-youtube-on-chrome/articleshow/103843400.cms&sa=U&ved=2ahUKEwjJ0Iibm_iDAxWNqZUCHToXDMk4HhDF9AF6BAgEEAI&usg=AOvVaw1go6icBgge6IF8YVY8SO8M,2023-09-25 14:52:41.558146,Gadgets Now,google
242,Google starts rolling out auto-archive feature to Android users: Here’s how it works,/url?q=https://indianexpress.com/article/technology/tech-news-technology/google-starts-rolling-out-auto-archive-feature-to-android-users-heres-how-it-works-8552077/&sa=U&ved=2ahUKEwjJ0Iibm_iDAxWNqZUCHToXDMk4HhDF9AF6BAgDEAI&usg=AOvVaw0MFu4DuGRhhhStXEblF2Re,2023-04-25 14:52:41.558146,The Indian Express,google
243,Google is bringing AI to Android Auto for some reason,/url?q=https://www.androidpolice.com/google-app-android-auto-ai-message-summaries/&sa=U&ved=2ahUKEwjJ0Iibm_iDAxWNqZUCHToXDMk4HhDF9AF6BAgAEAI&usg=AOvVaw2Y31Q47cWd-D1DVOw_ielL,2023-09-25 14:52:41.558146,Android Police,google
244,"Okta AI with Google Vertex provides real-time security, automatic logout",/url?q=https://www.sdxcentral.com/articles/news/okta-ai-with-google-vertex-provides-real-time-security-automatic-logout/2023/10/&sa=U&ved=2ahUKEwjJ0Iibm_iDAxWNqZUCHToXDMk4HhDF9AF6BAgIEAI&usg=AOvVaw2m9Bap1A7fkfgCBOYjvvIp,2023-10-25 14:52:41.558146,SDxCentral,google
245,"Android Auto is getting new AI-powered features, including suggested replies and actions",/url?q=https://techcrunch.com/2024/01/17/android-auto-is-getting-new-ai-powered-features-including-suggested-replies-and-actions/&sa=U&ved=2ahUKEwjJ0Iibm_iDAxWNqZUCHToXDMk4HhDF9AF6BAgBEAI&usg=AOvVaw2nlYDueIajVFjH7w-iPhd0,2023-12-25 14:52:41.558146,TechCrunch,google
246,Tesla's own former AI engineer trolls the company: 'full self-wiping',/url?q=https://electrek.co/2024/01/23/tesla-own-former-ai-engineer-trolls-full-self-wiping/&sa=U&ved=2ahUKEwiLkOubm_iDAxU1npUCHUw3CgIQxfQBegQICBAC&usg=AOvVaw1Qha7mmvtNe3O4tEoGUwEW,2023-12-25 14:52:41.558146,Electrek,google
247,"World Street | SAP's AI scale-up, Tesla's subdued growth outlook, China's dovish pitch, Saudi's first...",/url?q=https://www.moneycontrol.com/news/business/markets/world-street-saps-ai-scale-up-teslas-subdued-growth-outlook-chinas-dovish-pitch-saudis-first-alcohol-store-12120941.html&sa=U&ved=2ahUKEwiLkOubm_iDAxU1npUCHUw3CgIQxfQBegQICRAC&usg=AOvVaw1MzSmlyPmm5mtfwWmdOq26,2024-01-25 08:52:41.558146,Moneycontrol,google
248,Musk Reiterates Demand For More Control Of Tesla Saying It’s To Safeguard Against AI Tech Going ‘Awry’,/url?q=https://www.forbes.com/sites/siladityaray/2024/01/25/musk-reiterates-demand-for-more-control-of-tesla-saying-its-to-safeguard-against-ai-tech-going-awry/&sa=U&ved=2ahUKEwiLkOubm_iDAxU1npUCHUw3CgIQxfQBegQIBhAC&usg=AOvVaw04eGE8_4VPMAmWe_9ZcETi,2024-01-25 12:52:41.558146,Forbes,google
249,Elon Musk expects 1 billion humanoid robots by 2040s,/url?q=https://m.economictimes.com/news/international/us/elon-musk-expects-1-billion-humanoid-robots-by-2040s/articleshow/107059870.cms&sa=U&ved=2ahUKEwiLkOubm_iDAxU1npUCHUw3CgIQxfQBegQIBBAC&usg=AOvVaw3uj8zsMToy-Pqua4fM8__-,2024-01-23 14:52:41.558146,The Economic Times,google
250,"Elon Musk gives Tesla ultimatum: Another 12% of shares or no AI, robotics",/url?q=https://arstechnica.com/cars/2024/01/elon-musk-gives-tesla-ultimatum-another-12-of-shares-or-no-ai-robotics/&sa=U&ved=2ahUKEwiLkOubm_iDAxU1npUCHUw3CgIQxfQBegQIBxAC&usg=AOvVaw3Z2r7_QEW1xHTXJHrI56iG,2023-12-25 14:52:41.558146,Ars Technica,google
251,Elon Musk seeks greater share of Tesla before pushing AI ambitions,/url?q=https://www.theguardian.com/technology/2024/jan/16/elon-musk-ai-share-tesla&sa=U&ved=2ahUKEwiLkOubm_iDAxU1npUCHUw3CgIQxfQBegQIARAC&usg=AOvVaw0khPK9P4Qg9AaSuAABtCuW,2023-12-25 14:52:41.558146,The Guardian,google
252,Elon Musk wants more control of Tesla before expanding AI development,/url?q=https://www.businessinsider.com/elon-musk-more-control-tesla-before-expanding-ai-development-2024-1&sa=U&ved=2ahUKEwiLkOubm_iDAxU1npUCHUw3CgIQxfQBegQIAxAC&usg=AOvVaw14CR2H2qhjmF7T79Ew8E4O,2023-12-25 14:52:41.558146,Business Insider,google
253,Elon Musk says he’d rather build AI outside of Tesla without new comp package,/url?q=https://www.teslarati.com/elon-musk-tesla-new-compensation-package-build-outside/&sa=U&ved=2ahUKEwiLkOubm_iDAxU1npUCHUw3CgIQxfQBegQIABAC&usg=AOvVaw3UavQuRZOJuNMvQr9iXduH,2023-12-25 14:52:41.558146,Teslarati,google
254,Musk warns he won’t invest in Tesla AI efforts without more power,/url?q=https://thehill.com/policy/technology/4411216-musk-warns-he-wont-invest-in-tesla-ai-efforts-without-more-power/&sa=U&ved=2ahUKEwiLkOubm_iDAxU1npUCHUw3CgIQxfQBegQIAhAC&usg=AOvVaw0ljxmJ1157YBX65LZaohsM,2023-12-25 14:52:41.558146,The Hill,google
255,"Musk wants a bigger share in Tesla to grow AI, robotics business",/url?q=https://www.computerworld.com/article/3712244/musk-wants-a-bigger-share-in-tesla-to-grow-ai-robotics-business.html&sa=U&ved=2ahUKEwiLkOubm_iDAxU1npUCHUw3CgIQxfQBegQIBRAC&usg=AOvVaw1ZRYgY41zDDz_1ECTS6RI1,2023-12-25 14:52:41.558146,Computerworld,google
256,Musk waves goodbye to Tesla's growth targets,/url?q=https://www.deccanherald.com/opinion/musk-waves-goodbye-to-teslas-growth-targets-2863803&sa=U&ved=2ahUKEwi20sGcm_iDAxUvqJUCHbXXCzc4ChDF9AF6BAgAEAI&usg=AOvVaw1FlKfH-ETERTfx_gdFrwaC,2024-01-25 09:52:41.558146,Deccan Herald,google
257,4 Key Takeaways From Elon Musk's Remarks During Tesla's Earnings Call,/url?q=https://www.investopedia.com/4-key-takeaways-from-elon-musk-s-remarks-during-tesla-s-earnings-call-8549480&sa=U&ved=2ahUKEwi20sGcm_iDAxUvqJUCHbXXCzc4ChDF9AF6BAgJEAI&usg=AOvVaw2Y7Xx7NJ4wTYIhlLbTZicc,2024-01-25 07:52:41.558146,Investopedia,google
258,"Elon Musk looking for 25% voting share at Tesla ahead of AI, robotics growth | Mint",/url?q=https://www.livemint.com/companies/news/elon-musk-looking-for-25-voting-share-at-tesla-ahead-of-ai-robotics-growth-11705379396448.html&sa=U&ved=2ahUKEwi20sGcm_iDAxUvqJUCHbXXCzc4ChDF9AF6BAgDEAI&usg=AOvVaw36laTdzs_ZM6zxZckOob1q,2023-12-25 14:52:41.558146,Mint,google
259,BYD senior exec taunts Musk that Tesla will lose market share and face challenges in its AI self-driving system,/url?q=https://fortune.com/asia/2024/01/24/byd-senior-exec-taunts-musk-tesla-lose-market-share-face-challenges-ai-self-driving-system/&sa=U&ved=2ahUKEwi20sGcm_iDAxUvqJUCHbXXCzc4ChDF9AF6BAgFEAI&usg=AOvVaw1h3Sph-oM-KiR6FftPo_QA,2024-01-24 16:52:41.558146,Fortune,google
260,Tesla Earnings: Musk's Next Growth Wave Is Still in the Distance,/url?q=https://www.bloomberg.com/opinion/articles/2024-01-25/tesla-earnings-musk-s-next-growth-wave-is-still-in-the-distance&sa=U&ved=2ahUKEwi20sGcm_iDAxUvqJUCHbXXCzc4ChDF9AF6BAgGEAI&usg=AOvVaw2k3cwHSczVnGK07vl-pAFc,2024-01-25 06:52:41.558146,Bloomberg.com,google
261,Elon Musk says Tesla Dojo AI supercomputer is a long shot worth taking,/url?q=https://www.shacknews.com/article/138442/tesla-dojo-ai-supercomputer-elon-musk-long-shot&sa=U&ved=2ahUKEwi20sGcm_iDAxUvqJUCHbXXCzc4ChDF9AF6BAgIEAI&usg=AOvVaw3YHrc7dRmswy6gu2-BUWrT,2024-01-25 05:52:41.558146,Shacknews,google
262,Elon Musk demands 25% voting control of Tesla before expanding AI. Here's why investors are spooked.,/url?q=https://www.cbsnews.com/news/tesla-elon-musk-25-percent-control-ai-what-it-means/&sa=U&ved=2ahUKEwi20sGcm_iDAxUvqJUCHbXXCzc4ChDF9AF6BAgCEAI&usg=AOvVaw3z_01r9B5NhCDQ5w6C9Rpc,2023-12-25 14:52:41.558146,CBS News,google
263,Musk wants 25% voting control at Tesla before fulfilling AI goal,/url?q=https://www.reuters.com/technology/musk-seeks-25-voting-share-tesla-2024-01-16/&sa=U&ved=2ahUKEwi20sGcm_iDAxUvqJUCHbXXCzc4ChDF9AF6BAgHEAI&usg=AOvVaw0_u_CDhzyXqoBkUvDgBusE,2023-12-25 14:52:41.558146,Reuters,google
264,Tesla rolls out FSD v12 beta: will AI finally nail down autonomous driving?,/url?q=https://www.drivencarguide.co.nz/news/tesla-rolls-out-fsd-v12-beta-will-ai-finally-nail-down-autonomous-driving/&sa=U&ved=2ahUKEwi20sGcm_iDAxUvqJUCHbXXCzc4ChDF9AF6BAgEEAI&usg=AOvVaw3eEfekbMBXT24Ra7P6eYPK,2023-12-25 14:52:41.558146,Driven Car Guide,google
265,Wall Street Loves Tesla for Its AI and Its Robots — Not for Its Cars,/url?q=https://heatmap.news/electric-vehicles/tesla-earnings-ai-elon-musk&sa=U&ved=2ahUKEwi20sGcm_iDAxUvqJUCHbXXCzc4ChDF9AF6BAgBEAI&usg=AOvVaw0Ue9Kra_6dgoHJ_iwxVB7X,2024-01-23 14:52:41.558146,Heatmap News,google
266,Elon Musk wants atleast 25% voting control of Tesla before building its AI,/url?q=https://www.business-standard.com/world-news/elon-musk-wants-atleast-25-voting-control-of-tesla-before-building-its-ai-124011600088_1.html&sa=U&ved=2ahUKEwjKoJWdm_iDAxVApZUCHadKDko4FBDF9AF6BAgEEAI&usg=AOvVaw3luOTrS9d_bA2L9TEjXScK,2023-12-25 14:52:41.558146,Business Standard,google
267,Musk's Tesla may be weeks away from its “ChatGPT Moment” of FSD,/url?q=https://fortune.com/2024/01/23/elon-musk-tesla-fsdbeta-v12-chatgpt-moment-ai/&sa=U&ved=2ahUKEwjKoJWdm_iDAxVApZUCHadKDko4FBDF9AF6BAgJEAI&usg=AOvVaw1QV-GUUfnO62WM-1Eq7UQZ,2023-12-25 14:52:41.558146,Fortune,google
268,Tesla accident sent AI anxiety up | Mint,/url?q=https://www.livemint.com/opinion/quick-edit/tesla-accident-sent-ai-anxiety-up-11703777882847.html&sa=U&ved=2ahUKEwjKoJWdm_iDAxVApZUCHadKDko4FBDF9AF6BAgCEAI&usg=AOvVaw0sLMACPde4mdwQBDx6qAEh,2023-09-25 14:52:41.558146,Mint,google
269,Tesla's AI Revolution: Morgan Stanley Predicts Explosive Growth,/url?q=https://www.forbes.com/sites/jonmarkman/2023/12/18/teslas-ai-revolution-morgan-stanley-predicts-explosive-growth/&sa=U&ved=2ahUKEwjKoJWdm_iDAxVApZUCHadKDko4FBDF9AF6BAgHEAI&usg=AOvVaw29hV2s1DO5Sd-rqd8_Vohv,2023-12-25 14:52:41.558146,Forbes,google
270,Tesla Stock Seesaws After Elon Musk Says He Wants 25% Control Before Advancing AI,/url?q=https://www.investopedia.com/tesla-stock-seesaws-after-elon-musk-says-he-wants-25-control-before-advancing-ai-8426638&sa=U&ved=2ahUKEwjKoJWdm_iDAxVApZUCHadKDko4FBDF9AF6BAgBEAI&usg=AOvVaw1Ku4JHzsEnauqmRM0Py7d4,2023-12-25 14:52:41.558146,Investopedia,google
271,Musk Demands Bigger Stake in Tesla as Price for A.I. Work,/url?q=https://www.nytimes.com/2024/01/16/business/tesla-elon-musk-stock.html&sa=U&ved=2ahUKEwjKoJWdm_iDAxVApZUCHadKDko4FBDF9AF6BAgFEAI&usg=AOvVaw1MV5lenQI67hw-2Yk-8zOY,2023-12-25 14:52:41.558146,The New York Times,google
272,Elon Musk-led Tesla releases earnings today: What is in store?,/url?q=https://finance.yahoo.com/news/elon-musk-led-tesla-releases-123053187.html&sa=U&ved=2ahUKEwjKoJWdm_iDAxVApZUCHadKDko4FBDF9AF6BAgGEAI&usg=AOvVaw0CUg2cYPGzKFCbOnYqMzKJ,2024-01-24 18:52:41.558146,Yahoo Finance,google
273,"Elon Musk expresses discomfort, seeks increased voting control at Tesla to advance AI initiatives",/url?q=https://www.indiatvnews.com/technology/news/elon-musk-s-discomfort-spurs-desire-for-enhanced-voting-influence-at-tesla-for-ai-development-2024-01-16-912029&sa=U&ved=2ahUKEwjKoJWdm_iDAxVApZUCHadKDko4FBDF9AF6BAgDEAI&usg=AOvVaw18FprUSfhidvFGE5D48rv9,2023-12-25 14:52:41.558146,India TV News,google
274,"""I'm Uncomfortable..."": Elon Musk On Why He Wants Greater Control of Tesla",/url?q=https://www.ndtv.com/world-news/elon-musk-on-why-he-wants-greater-control-of-tesla-before-building-ai-4873210&sa=U&ved=2ahUKEwjKoJWdm_iDAxVApZUCHadKDko4FBDF9AF6BAgIEAI&usg=AOvVaw0ba4FUUl17AqtTIpMKiUgo,2023-12-25 14:52:41.558146,NDTV,google
275,"Tesla earnings call: AI talk, Gigafactory plans, Cybertruck and Optimus robot buzz",/url?q=https://seekingalpha.com/news/4058251-tesla-earnings-call-ai-talk-gigafactory-plans-cybertruck-and-optimus-robot-buzz&sa=U&ved=2ahUKEwjKoJWdm_iDAxVApZUCHadKDko4FBDF9AF6BAgAEAI&usg=AOvVaw3FXI-AfkSFB53UU683kpqj,2024-01-25 04:52:41.558146,Seeking Alpha,google
276,Tesla Earnings Preview: What Wall Street Expects From the EV Maker,/url?q=https://markets.businessinsider.com/news/stocks/tesla-earnings-preview-tsla-stock-price-outlook-elon-musk-ai-2024-1&sa=U&ved=2ahUKEwjb7-mdm_iDAxUsrJUCHUmKCjc4HhDF9AF6BAgBEAI&usg=AOvVaw38spm2U8knxzla_1y-ARQG,2023-12-25 14:52:41.558146,Markets Insider,google
277,Elon Musk Reveals Tesla's 'Optimus' AI Robot Can Fold Shirts For You,/url?q=https://www.news18.com/tech/elon-musk-reveals-teslas-optimus-ai-robot-can-fold-shirts-for-you-8743315.html&sa=U&ved=2ahUKEwjb7-mdm_iDAxUsrJUCHUmKCjc4HhDF9AF6BAgJEAI&usg=AOvVaw0Gy7itHs3HVcJFsALhI16n,2023-12-25 14:52:41.558146,News18,google
278,Today’s Cache | Caution urged on AI regulation in EU; Tesla autopilot lawsuit heads to trial; OpenAI’s CEO ouster forewarned of breakthrough,/url?q=https://www.thehindu.com/sci-tech/technology/todays-cache-caution-urged-on-ai-regulation-in-eu-tesla-autopilot-lawsuit-heads-to-trial-openais-ceo-ouster-forewarned-of-breakthrough/article67569121.ece&sa=U&ved=2ahUKEwjb7-mdm_iDAxUsrJUCHUmKCjc4HhDF9AF6BAgIEAI&usg=AOvVaw3SWkhBoJG7y0nV2EIWtOgL,2023-11-25 14:52:41.558146,The Hindu,google
279,Musk denies report his AI company secures $500 million toward $1 billion funding goal,/url?q=https://www.reuters.com/technology/musks-ai-company-secures-500-mln-toward-1-bln-funding-goal-bloomberg-news-2024-01-20/&sa=U&ved=2ahUKEwjb7-mdm_iDAxUsrJUCHUmKCjc4HhDF9AF6BAgHEAI&usg=AOvVaw37dZ_BILCFK-Jfu7M4xzBr,2024-01-20 14:52:41.558146,Reuters,google
280,"ChatGPT takes a dig at Elon Musk's AI model Grok over ‘common’ responses, Tesla chief hits back | Mint",/url?q=https://www.livemint.com/ai/artificial-intelligence/chatgpt-takes-a-dig-at-elon-musks-ai-model-grok-over-common-responses-tesla-chief-hits-back-11702209921944.html&sa=U&ved=2ahUKEwjb7-mdm_iDAxUsrJUCHUmKCjc4HhDF9AF6BAgGEAI&usg=AOvVaw1OT46_8MWyjFvu6o_n5Rgs,2023-12-25 14:52:41.558146,Mint,google
281,"Elon Musk dealing with massive investor dissatisfaction at Tesla, wants to own 25% before building AI",/url?q=https://www.firstpost.com/tech/auto-tech/elon-musk-dealing-with-massive-investor-dissatisfaction-at-tesla-wants-to-own-25-before-building-ai-13619022.html&sa=U&ved=2ahUKEwjb7-mdm_iDAxUsrJUCHUmKCjc4HhDF9AF6BAgDEAI&usg=AOvVaw1qfVmFUutu7Ai7L6a3usXj,2023-12-25 14:52:41.558146,Firstpost,google
282,C3.ai Stock; AI Stock Surges; Is C3.ai Stock A Buy Amid Tech Rally?,/url?q=https://www.investors.com/research/ai-stock-teslas-musk-starts-ai-company-with-100-mil-private-stock-sale-is-ai-stock-a-buy/&sa=U&ved=2ahUKEwjb7-mdm_iDAxUsrJUCHUmKCjc4HhDF9AF6BAgFEAI&usg=AOvVaw00xnL1H9jnbCyMXAkle3sL,2024-01-23 14:52:41.558146,Investor's Business Daily,google
283,"Elon Musk wants more Tesla control in AI, robot advancements",/url?q=https://www.mysanantonio.com/business/article/elon-musk-tesla-ai-18616729.php&sa=U&ved=2ahUKEwjb7-mdm_iDAxUsrJUCHUmKCjc4HhDF9AF6BAgEEAI&usg=AOvVaw1753MnYgBn2NBby2eJ68xe,2024-01-20 14:52:41.558146,MySA,google
284,Elon Musk wants 25% voting control of Tesla before pursuing AI goal,/url?q=https://www.thenationalnews.com/business/technology/2024/01/16/elon-musk-wants-25-voting-control-of-tesla-before-pursuing-ai-goal/&sa=U&ved=2ahUKEwjb7-mdm_iDAxUsrJUCHUmKCjc4HhDF9AF6BAgCEAI&usg=AOvVaw2r8bG9PwOXsa3LXjFBlk71,2023-12-25 14:52:41.558146,The National,google
285,Elon Musk Seeks More Sway Over Tesla Ahead of AI Advancements,/url?q=https://www.wsj.com/business/autos/elon-musk-seeks-greater-control-over-tesla-ahead-of-ai-advancements-f9139b12&sa=U&ved=2ahUKEwjb7-mdm_iDAxUsrJUCHUmKCjc4HhDF9AF6BAgAEAI&usg=AOvVaw0lQsFjMtGGFqTKPVDr92Zb,2023-12-25 14:52:41.558146,WSJ,google
286,ELON MUSK IS LAUNCHING 6G PHONE. There’s speculation about a potential… | by ATHARV AMBADE,/url?q=https://medium.com/%40bhadashot/elon-musk-is-launching-6g-phone-631a5f715dc6&sa=U&ved=2ahUKEwi-xb6em_iDAxXLrZUCHQueARUQxfQBegQIBRAC&usg=AOvVaw2zCe-oowWgdi6z4-Xs496P,2023-11-25 14:52:41.558146,Medium,google
287,Tesla Cybertruck bi-directional charging ad features Nothing Phone (1) cameo,/url?q=https://www.teslarati.com/tesla-cybertruck-bidirectional-charging-ad-nothing-phone-cameo/&sa=U&ved=2ahUKEwi-xb6em_iDAxXLrZUCHQueARUQxfQBegQICRAC&usg=AOvVaw3-FSabE8crJspvc7Dlylv_,2023-12-25 14:52:41.558146,Teslarati,google
288,Nothing Phone (1) makes a cameo appearance in Tesla Cybertruck teaser,/url?q=https://www.gizmochina.com/2024/01/23/nothing-phone-1-cameo-cybertruck-teaser/&sa=U&ved=2ahUKEwi-xb6em_iDAxXLrZUCHQueARUQxfQBegQIARAC&usg=AOvVaw1nqSrSbadvPqm-YiXVihOX,2023-12-25 14:52:41.558146,Gizmochina,google
289,"Is the Tesla Phone real: Rumors, speculation & more",/url?q=https://www.dexerto.com/tech/tesla-phone-2150416/&sa=U&ved=2ahUKEwi-xb6em_iDAxXLrZUCHQueARUQxfQBegQIBxAC&usg=AOvVaw3e5PrRkMflx_KflG6dkDKH,2023-11-25 14:52:41.558146,Dexerto,google
290,Tesla Chief Elon Musk ‘interning’ with phone-makers Nothing? Twitter answers | Mint,/url?q=https://www.livemint.com/news/world/tesla-chief-elon-musk-interning-with-phone-makers-nothing-twitter-answers-11683217930026.html&sa=U&ved=2ahUKEwi-xb6em_iDAxXLrZUCHQueARUQxfQBegQIAhAC&usg=AOvVaw1aMzkBjH18OJ2ZpN2rxCdq,2023-05-25 14:52:41.558146,Mint,google
291,"Elon Musk’s phone was once taken away and locked in a cupboard by Tesla board member, here’s why",/url?q=https://www.indiatoday.in/technology/news/story/elon-musks-phone-was-once-taken-away-and-locked-in-a-cupboard-by-tesla-board-member-heres-why-2403369-2023-07-07&sa=U&ved=2ahUKEwi-xb6em_iDAxXLrZUCHQueARUQxfQBegQIBBAC&usg=AOvVaw3bnLS4TN7QmvghnbQBNDYW,2023-07-25 14:52:41.558146,India Today,google
292,Why we think the Tesla Phone is probably never going to happen,/url?q=https://www.digitaltrends.com/mobile/tesla-phone-price-release-date-news-rumors/&sa=U&ved=2ahUKEwi-xb6em_iDAxXLrZUCHQueARUQxfQBegQICBAC&usg=AOvVaw2M3gfoCuGnYUVQHQ-wxz5n,2023-03-25 14:52:41.558146,Digital Trends,google
293,Tesla App Update 4.29 Release Notes,/url?q=https://www.notateslaapp.com/tesla-app-updates/version/4.29/release-notes&sa=U&ved=2ahUKEwi-xb6em_iDAxXLrZUCHQueARUQxfQBegQIABAC&usg=AOvVaw3ibVWZ8wwx4IIkOyhYqOKp,2023-12-25 14:52:41.558146,Not a Tesla App,google
294,What Is the Tesla Phone?,/url?q=https://www.alphr.com/what-is-the-tesla-phone/&sa=U&ved=2ahUKEwi-xb6em_iDAxXLrZUCHQueARUQxfQBegQIBhAC&usg=AOvVaw0NvabhFVNhn9u2UG_Q_qyc,2023-05-25 14:52:41.558146,Alphr,google
295,Musk once laughed off BYD as a threat. Now the Chinese giant has taken Tesla's EV crown — here's how,/url?q=https://www.cnbc.com/2024/01/05/how-byd-grew-from-a-phone-battery-maker-to-ev-giant-taking-on-tesla.html&sa=U&ved=2ahUKEwi-xb6em_iDAxXLrZUCHQueARUQxfQBegQIAxAC&usg=AOvVaw22JgJE3mANnphFhSSZcfCe,2023-10-25 14:52:41.558146,CNBC,google
296,Elon Musk’s Starlink Launches First-Ever Cell Service Satellites—Here’s What To Know And What Mobile Phone Carrier Gets It First,/url?q=https://www.forbes.com/sites/roberthart/2024/01/03/elon-musks-starlink-launches-first-ever-cell-service-satellites-heres-what-to-know-and-what-mobile-phone-carrier-gets-it-first/&sa=U&ved=2ahUKEwiN7JSfm_iDAxWuqJUCHd3HDlU4ChDF9AF6BAgCEAI&usg=AOvVaw1btmn5VxexQNP6cKPZ5yZX,2023-10-25 14:52:41.558146,Forbes,google
297,"Tesla phone, Xiaomi EV? The line between your car and phone is starting to blur – and it's a good thing",/url?q=https://www.techradar.com/vehicle-tech/tesla-phone-xiaomi-ev-the-line-between-your-car-and-your-phone-is-starting-to-blur-and-its-a-good-thing&sa=U&ved=2ahUKEwiN7JSfm_iDAxWuqJUCHd3HDlU4ChDF9AF6BAgJEAI&usg=AOvVaw0XTK9UHOZEz6Lm5Hs7Z2Gl,2023-12-25 14:52:41.558146,TechRadar,google
298,"Phonemaker Xiaomi unveils first EV, seeking to take on Tesla in China",/url?q=https://www.businessinsider.com/phonemaker-xiaomi-unveils-first-ev-taking-on-tesla-2023-12&sa=U&ved=2ahUKEwiN7JSfm_iDAxWuqJUCHd3HDlU4ChDF9AF6BAgGEAI&usg=AOvVaw2H6Gd1mDJ3xIiz9aUFITk5,2023-12-25 14:52:41.558146,Business Insider,google
299,Nio Phone: a hands-on look at the first handset by an automaker · TechNode,/url?q=https://technode.com/2023/09/22/nio-phone-a-hands-on-look-at-the-first-smartphone-by-a-chinese-automaker/&sa=U&ved=2ahUKEwiN7JSfm_iDAxWuqJUCHd3HDlU4ChDF9AF6BAgEEAI&usg=AOvVaw3ocE5iIg3hTEihaqtpi1jG,2023-09-25 14:52:41.558146,TechNode,google
300,"Polestar, Tesla's Rival, Plans to Launch a Smartphone with its Debut Electric Vehicle in China",/url?q=https://ciolook.com/polestar-teslas-rival-plans-to-launch-a-smartphone-with-its-debut-electric-vehicle-in-china/&sa=U&ved=2ahUKEwiN7JSfm_iDAxWuqJUCHd3HDlU4ChDF9AF6BAgDEAI&usg=AOvVaw0c8cNdu7x5AcM7bVcy0HZE,2023-09-25 14:52:41.558146,CIOLook,google
301,"A Cell Phone, A Door, A Tesla Roadster And Other Stuff We Found Last Week",/url?q=https://jalopnik.com/a-cell-phone-a-door-a-tesla-roadster-and-other-stuff-1851163007&sa=U&ved=2ahUKEwiN7JSfm_iDAxWuqJUCHd3HDlU4ChDF9AF6BAgAEAI&usg=AOvVaw309_wuKacviDNzhUFB8B21,2023-12-25 14:52:41.558146,Jalopnik,google
302,Tesla Wireless Charging Platform: Convenience Has a Cost,/url?q=https://www.wired.com/review/tesla-wireless-charger/&sa=U&ved=2ahUKEwiN7JSfm_iDAxWuqJUCHd3HDlU4ChDF9AF6BAgHEAI&usg=AOvVaw1HdSKsM5LOIcaBlGwf4MPI,2023-12-25 14:52:41.558146,WIRED,google
303,Is Tesla About To Create A Smartphone?,/url?q=https://techround.co.uk/news/is-tesla-about-to-create-smartphone/&sa=U&ved=2ahUKEwiN7JSfm_iDAxWuqJUCHd3HDlU4ChDF9AF6BAgIEAI&usg=AOvVaw16OJJEaN31BK_uuUWYz2tm,2023-09-25 14:52:41.558146,TechRound,google
